Project ID,Project Leader,Project Title,Fellowship recipient,Fellowshiptype
DP0666620,"Fleming, A","Analysis, Optimization, and Control of Scanning Atomic Force Microscope Micro-Cantilever Probes",Dr AJ Fleming,APD
DP0666632,"Filar, J",Doubly Stochastic Matrices & The Hamiltonian Cycle Problem,Prof JA Filar,APF
DP0666652,"McDougall, D","Christianity, conflict, and culture: an anthropological investigation of the political role of churches in Solomon Islands",Dr D McDougall,APD
DP0666656,"Lyytikäinen, K",Complex Dopant Diffusivity in Photonic Crystal Fibres and Applications,Dr KJ Lyytikäinen,APD
DP0666699,"Horton, K",Collective Obligations and Partial Compliance,Dr KJ Horton,APD
DP0666770,"Rocha, C",A study of the Brazilian community in Australia and Australian-Brazilian bilateral exchange ,Dr C Rocha,APD
DP0666772,"Remington, R",A Scalable Theory of Behavior Composition for Practical Engineering Models of Human Performance,Dr RW Remington,APF
DP0666853,"Zhao, Y",Superconducting MgB2 thin films and structures for electronic devices and telecommunication applications,Mr Y Zhao,APD
DP0666857,"Davis, C",Establishing how head and face movement properties contribute to the perception of speech and identity,Dr J Kim,QEII
DP0666883,"Bilek, M",Design and synthesis of transparent conducting metal oxides,Dr SH Lim,APD
DP0666891,"Bengtson Nash, S","Assessment of the Risks Posed to an Antarctic Keystone Species, Antarctic krill (Euphausia superba), Through Exposure to Persistent Organic Pollutants",Miss SM Bengtson Nash,APD
DP0666927,"Keller, J",Novel Concept for Wastewater Treatment with Integrated Power Production based on Microbial Fuel Cells,Prof J Keller,APF
DP0666970,"Jormakka, M",Structural determination of respiratory membrane protein complexes by X-ray crystallography,Dr M Jormakka,APD
DP0666981,"Kuratate, T","Building a Talking Head via Dynamic & 3D-Static, and Age- & Ethnically-Varied Databases: Perceptibility and Acceptability",Dr T Kuratate,APD
DP0667002,"White, S",The Making of Black Manhattan,Prof S White,APF
DP0667093,"Willgoose, G","TERRESIM: A simulation system for understanding and managing the interactions between runoff, vegetation, soils and climate in a changing environment",Prof GR Willgoose,APF
DP0667101,"Pas, S","Understanding, Control, and Optimisation of Free Volume Mediated Transport in Technologically Important Materials.",Mr SJ Pas,APD
DP0667253,"Grove, R",British Empire and the Natural World: the Environmental History of the British Empire and Commonwealth 1600-2000,Dr RH Grove,APF
DP0769972,"Barner-Kowollik, C","Defining Polymer Structures in Radical Polymerization Systems: Chain Birth, Chain Growth and Complex Macromolecular Architectures",A/Prof C Barner-Kowollik,APF
DP0769983,"Martinac, B",Force from lipids: the role of the lipid bilayer in mechanosensory transduction,Prof B Martinac,APF
DP0769983,"Martinac, B",Force from lipids: the role of the lipid bilayer in mechanosensory transduction,Dr BA Corry,ARF
DP0769992,"Dell, J",Growth dynamics and innovative spectroscopic techniques for real-time control of advanced electronics materials grown by molecular beam epitaxy,Dr RH Sewell,APD
DP0770023,"Lee, C",Many-body quantum effects in the physics of ultracold atoms,Dr C Lee,APD
DP0770036,"Koopman, P",How the Y Chromosome makes a male: Molecular genetic analysis of key sex-determining genes,Prof PA Koopman,APF
DP0770050,"Baer, B","Sex, Sperm and Society. Insights into the evolutionary potential of sexual conflict in insects: a fundamental question in evolutionary biology",Dr BC Baer,QEII
DP0770057,"Jennions, M","Does size really matter? Selection, constraints and allometry",Dr MD Jennions,QEII
DP0770094,"Lowe, R",Hydrodynamics of Fringing Reef Systems,Dr RJ Lowe,APD
DP0770177,"Burley, G",Understanding and controlling the construction of molecular electronic and photovoltaic devices using nucleic acids,Dr GA Burley,QEII
DP0770205,"Dou, S",Current limiting mechanisms in magnesium diboride superconductors,Dr C Jiang,APD
DP0770205,"Dou, S",Current limiting mechanisms in magnesium diboride superconductors,Prof SX Dou,APF
DP0770241,"Gregg, M","Working from home: New media technology, workplace culture and the changing nature of domesticity",Dr MC Gregg,APD
DP0770253,"Marshall, C",Links Between Modern and Fossil Microbes and the Evolution of Life in Earth's Extreme Early Environments,Dr CP Marshall,QEII
DP0770266,"Akbarzadeh, S",Democratizing the Middle East: implications of Washington's policies,Mr Bj MacQueen,APD
DP0770271,"Barnier, A",From autobiographical memory to collective memory: An interdisciplinary study of individual and group cognition,Dr AJ Barnier,ARF
DP0770279,"Sukhorukov, A",Slow light in nanostructured materials,Dr AA Sukhorukov,QEII
DP0770332,"Curthoys, A","Indigenous peoples, the British Empire, and self-government for the Australian colonies.",Prof A Curthoys,APF
DP0770352,"Malpas, J",Ethos and Topos: A Philosophical Investigation of the Ethics and Politics of Place ,Prof JE Malpas,APF
DP0770358,"Gottlieb, N","Immigration, technology and literacy: key challenges for language policy in a changing Japan ",Prof NR Gottlieb,APF
DP0770375,"Mark, A",Dynamic modelling of biomolecular systems: Going beyond classical empirical force fields.,Dr CT Tuttle,APD
DP0770380,"Macdonald, D",Unlocking the potential of n-type silicon for solar cells,Dr DH Macdonald,QEII
DP0770396,"Brown, C",Evolution and development of a lateralised brain: A behavioural ecology perspective.,Dr C Brown,ARF
DP0770400,"Bryant, D",Cycle decompositions of graphs ,Dr DE Bryant,QEII
DP0770414,"Zuckermann, G",Revival' in the Middle East: The Genesis of Israeli ('Modern Hebrew') - lessons for revival of no-longer spoken Australian languages,Dr G Zuckermann,ARF
DP0770418,"Pitchford, R",Balancing the risk of harm with productivity in the mercurial firm: economic theory and applications to Australian policy. ,Prof R Pitchford,APF
DP0770420,"Zhang, T",Wavelet approaches for solving nonlinear dynamic systems in process engineering,Dr T Zhang,APD
DP0770424,"Zhang, Y",Development of room temperature diluted magnetic semiconductors for spintronics devices application,Dr Y Zhang,APD
DP0770426,"McClelland, D",Pushing the frontiers of gravitational wave science:  from technology to astrophysics,Dr BJ Slagmolen,APD
DP0770428,"Ferguson, K",A study of the public understanding of the Great Barrier Reef and its sustainable use,Dr KH Ferguson,APD
DP0770437,"Poulos, M",A New History of 1968: Feminism and Student Revolt in the Colonels' Greece (1967-1974),Dr M Poulos,APD
DP0770446,"Clarkson, C",The African origins of Asian and Australian lithic technologies: Exploring modern human origins and dispersals using new techniques of core analysis ,Dr CJ Clarkson,APD
DP0770451,"Liu, L",The origins of Asian domestic buffalo and its role in the development of agricultural technology,Mr T Gonzalez,APD
DP0770465,"Martin, J","Macrophage proteins: structure, function and e-science",A/Prof JL Martin,APF
DP0770519,"McClure-Griffiths, N",Understanding the Evolution of the Milky Way,Dr NM McClure-Griffiths,QEII
DP0770535,"Cumming, G",Evidence-based improvement of statistical inference practices in psychology and other disciplines,Ms F Fidler,APD
DP0770545,"Wolfendale, J",A study of Australia's ability to train soldiers to be effective and ethical,Dr JC Wolfendale,APD
DP0770546,"Febbraio, M",Autophagic vacuole formation in mammalian skeletal muscle; role of FOXO proteins.,Mr RJ Southgate,APD
DP0770585,"Xie, J",Novel Photo-Catalysts for Water Oxidation: Linking Nature to New Technologies,Dr J Xie,APD
DP0770586,"Hewitt, B","Marital separation and divorce: social correlates, gender differences and initiation",Ms BA Hewitt,APD
DP0770588,"Winther-Jensen, B",Switchable interfaces,Dr B Winther-Jensen,APD
DP0770640,"Orford, A",Cosmopolitanism and the Future of International Law,Prof AM Orford,APF
DP0770649,"Hill, J",Modelling applications of nanomaterials in biology and medicine,Dr N Thamwattana,APD
DP0770659,"Allison, P","Food, drink and sociality in the early Roman Empire and their significance for understanding ancient family and community life",Dr PM Allison,QEII
DP0770666,"Lewandowsky, S",Keeping Memory Current: Updating and Discounting of Information,Prof S Lewandowsky,APF
DP0770679,"Sheahan, M",The Dynamics of Plant Cell Division-Discovering the Mechanisms of Organelle Inheritance,Mr MB Sheahan,APD
DP0770685,"Johnston, A",A study of travel writing in Australian colonial history,Dr A Johnston,QEII
DP0770692,"Canning, J","Advanced Laser, Sensor and Diagnostic Technologies Using New Generation Micro- and Nano- Structured Fibres and Gratings",Dr J Canning,APF
DP0770704,"Paolini, S",The Disproportionate Impact of Negative Contact on Category Salience and Prejudice: Explaining Why Intergroup Interactions Can Be Harmful,Dr S Paolini,APD
DP0770705,"Owczarek, A",Searching for solvability in Statistical Mechanics and beyond using advanced Enumerative Combinatorics,Dr I Jensen,ARF
DP0770705,"Owczarek, A",Searching for solvability in Statistical Mechanics and beyond using advanced Enumerative Combinatorics,Dr AD Rechnitzer,QEII
DP0770715,"Hollenberg, L",Quantum Nanotechnology: Concepts to Devices,A/Prof LC Hollenberg,APF
DP0770729,"Tuthill, P",DRAGONFLY: A revolutionary instrument for astronomical imaging,Dr PG Tuthill,QEII
DP0770744,"Dixon, R",New Electronic Archives for Australian Literature,Dr K Bode,APD
DP0770747,"McDonnell, M",A lossy compression paradigm for sensory neural coding,Mr MD McDonnell,APD
DP0770748,"Blair, D",Control of Instabilities in Advanced Gravitational Wave Detectors,Dr L Ju,ARF
DP0770759,"Pratchett, M",Climate change and coral reef communities: predicting and managing future impacts.,Dr MS Pratchett,ARF
DP0770844,"Lipp, O","The many faces of threat:  An investigation of animal, interpersonal and intergroup threat",Prof OV Lipp,APF
DP0770854,"Purdey, J",A study of the scholarship on Indonesia in Australia and its implications for foreign policy,Dr J Purdey,APD
DP0770878,"Kuo, F",Innovative Methods for Very High Dimensional Problems,Dr FY Kuo,QEII
DP0770889,"Pryke, S",Alternative life-history strategies in the evolution of colour polymorphism,Dr SR Pryke,APD
DP0770915,"Praeger, C",Finite permutation groups and flag-transitive incidence structures,Prof CE Praeger,APF
DP0770915,"Praeger, C",Finite permutation groups and flag-transitive incidence structures,Dr MR Giudici,ARF
DP0770920,"Pybus, C","Recovered Lives as Windows on the Anglo Colonial World, 1750-1850",Prof CJ Pybus,APF
DP0770923,"Jeffery, L",The Role of Adaptive Coding Mechanisms in the Development of Face Perception.,Dr LR Jeffery,APD
DP0770924,"Silvas, A","Basil of Caesarea and the nexus of Greek, Latin and Semitic cultures in late Antiquity",Dr AM Silvas,ARF
DP0770927,"Varghese, M",New approaches to index theory,Prof M Varghese,APF
DP0770930,"Losic, D",Engineered Nanotube Membranes for Molecular Separation and Biosensing ,Dr D Losic,ARF
DP0770938,"Chen, Z",Reconstruction of marine ecosystems following the greatest mass extinction during the Phanerozoic history of Earth life: Lessons for the present,Dr ZQ Chen,ARF
DP0770979,"Murphy, N",Evolution of the unique fauna of the Great Artesian Basin mound springs: the impact of aridification and climate change.,Dr NP Murphy,APD
DP0770987,"Zheng, R",Microscopic Origin of Ferromagnetism of Diluted Magnetic Demiconductors,Dr R Zheng,ARF
DP0770997,"Betts, A",East meets West: an archaeological study of early contact between China and Eurasia,Dr P Jia,APD
DP0771059,"Ostrovski, O",Alternative technology for titanium tetrachloride: production and chlorination of titanium oxycarbonitride,Prof O Ostrovski,APF
DP0771153,"Bray, I",Matter-antimatter interactions,Prof I Bray,APF
DP0771156,"Millar, A",The role of changes to the proteome in the signalling of stress response in plant mitochondria,Prof AH Millar,APF
DP0771183,"Boyd, S",Computational techniques for protease research,Dr SE Boyd,APD
DP0771218,"Miroshnichenko, A",Tunable nonlinear photonic devices with liquid crystals,Dr AE Miroshnichenko,APD
DP0771243,"Fischer, B",Towards a miniaturised on-chip terahertz biosensing system,Dr BM Fischer,APD
DP0771300,"Britz, T","Chromatic polynomials, random graphs, and error-correcting codes:  a unified approach to graph colouring problems",Dr T Britz,APD
DP0771338,"Abramov, V",Queueing systems and their application to telecommunication systems and dams,Dr V Abramov,APD
DP0771341,"Kloda, A",Mechanosensitive properties and modulation of N-methyl-D-aspartate (NMDA) receptors by lipid environment,Dr A Kloda,ARF
DP0771350,"Vickers, A",The Clothing Industry in the Asia Pacific: Managing Constant Change,Dr V Crinis,APD
DP0771377,"Muhlhaus, H",Computationally Modelling a Volcano: Flow and Stability.,Dr AJ Hale,APD
DP0771378,"Fischer, J",Sustainable Farms: Tree Regeneration and the Future of Farmland Biodiversity,Dr J Fischer,APD
DP0771387,"Buckley, Y",How do characteristics of seeds and landscape heterogeneity determine plant spread in new environments?,Dr YM Buckley,ARF
DP0771427,"Cernusak, L",Water-use efficiency of Australian tropical trees:  mechanistic analysis at multiple scales,Dr LA Cernusak,APD
DP0771430,"Zelikin, A",Disulfide Cross-linked Hollow Polymer Capsules for Drug Delivery,Dr AN Zelikin,APD
DP0771436,"Duffy, S","Spinoza, Kant and Deleuze on freedom and ethical difference: an immanent approach",Dr SB Duffy,APD
DP0771453,"Iqbal, A",Study of mathematical models of evolution using the theory of quantum games - strengthening the theoretical foundation of quantum computation,Mr A Iqbal,APD
DP0771492,"Finnane, M",Understanding forms of violence and their regulation in Australian history,Prof MJ Finnane,APF
DP0771504,"Sinha, R","Efficient Algorithms for In-memory Sorting, Searching and Indexing on Modern Multi-core Cache-based and Graphics Processor Architectures",Mr R Sinha,APD
DP0771521,"Sharman, J","Following the Money: The Birth, Diffusion and Effectiveness of the Global Regime to Counter Money Laundering and Terrorist Financing",Dr J Sharman,QEII
DP0771619,"Phillips, J",Community and identity in post-war European philosophy,Dr JA Phillips,ARF
DP0771627,"Hancock, J",Spatio-temporal modelling of Ras dependent MAP kinase activation,Dr T Tian,ARF
DP0771638,"Wyithe, S",Formation of Supermassive Black Holes,Dr S Wyithe,QEII
DP0771709,"Wu, Z",Filled function methods for global optimization and  their applications,Dr Z Wu,APD
DP0771800,"Dickenson, J",Managing trust: a comparative historical study of political accountability in Australia.,Dr J Dickenson,APD
DP0771823,"Schellart, W","Relationship between subduction zone geometry, trench kinematics and great subduction earthquakes",Dr WP Schellart,QEII
DP0771840,"Stello, D",Habitable planets and stellar oscillations with the NASA Kepler mission,Mr D Stello,APD
DP0771913,"Chapple, D",The success and rapid evolution of invasive species: resolving a genetic paradox,Dr DG Chapple,APD
DP0771959,"Stephenson, P",A study of the rise of Islam and community survival in Indigenous Australia,Dr PK Stephenson,APD
DP0772003,"Daborn, P",Insect development : the role of  cytochrome P450s,Dr PJ Daborn,ARF
DP0772050,"Burton, E",Unraveling the oxidative geochemistry of nanoparticulate mackinawite in acid sulfate soil landscapes,Dr ED Burton,APD
DP0772053,"Waters, T",Reactivity and Spectroscopy of Gas Phase Metal Oxide Cluster Ions: Structure-Reactivity Correlations and Fundamental Insights into Heterogeneous Catalysis,Dr T Waters,APD
DP0772155,"Taylor, N",Adaptations of plant mitochondria during cold acclimation in Arabidopsis thaliana: towards an understanding of plant cold acclimation,Dr NL Taylor,APD
DP0772186,"Seymour, J",Microbial Oceanography: Community Heterogeneity Fuelled by Environmental Variability,Dr JR Seymour,APD
DP0772191,"Schroeter, L",Two-Dimensional Semantics and the Foundations of Philosophy,Dr L Schroeter,ARF
DP0772215,"Stuart-Fox, D",The evolution of female resistance to male reproductive traits in animals,Dr D Stuart-Fox,APD
DP0772260,"Langrish, T",Surface Modification of Spray-Dried Powders By Surface-Active Proteins,Dr BP Adhikari,ARF
DP0772271,"Turchini, G","Omega-3 fatty acids, appetite and growth in farmed fish",Dr GM Turchini,APD
DP0772300,"Shadrivov, I",Engineering and control of metamaterials with negative refraction,Dr I Shadrivov,APD
DP0772325,"Eagle, M",Augustus Earle (1793-1838) and the roles of humanism and science in interpreting the world and its peoples.,Dr ME Eagle,APD
DP0772348,"Foo, E",The role of plant hormones in arbuscular mycorrhizal symbiosis,Dr E Foo,APD
DP0772361,"MacLeod, C",Selective information processing and anxiety problems,Dr E Wilson,APD
DP0772382,"Brady, M",Indigenous Australians and alcohol control: The impact of hotel ownership on harm reduction and social and economic development,Dr MA Brady,QEII
DP0772409,"Mora, P",Micromechanical modelling of fault gouge dynamics: towards an improved fault constitutive relation,Dr F Alonso-Marroquin,APD
DP0772417,"Li, B",A mechanism to authenticate porcelain treasures from the Yuan-Ming dynasties (1260-1644 AD) in China,Mr B Li,APD
DP0772418,"Phillips, B",Disperse or die: the evolution of dispersal ability in a changing climate.,Dr BL Phillips,APD
DP0772440,"Coller, I",Europe and Identity: A transcultural history of European communities in the Islamic world 1685-1800,Mr I Coller,APD
DP0772490,"Phan, C",Influence of adsorbed surfactants on three phase contact line motion at high capillary number,Mr CM Phan,APD
DP0772517,"Nelson, X",Visual processing in a unique modular system - how can a simple cognitive architecture be used to solve complex visual tasks?,Dr XJ Nelson,APD
DP0772551,"Du, X",Novel nanostructured high energy cathode material,Dr X Du,APD
DP0772571,"Westaway, K","Landscape evolution and palaeoclimates in Indonesia: environmental, faunal and archaeological implications.",Ms KE Westaway,APD
DP0772577,"Lailvaux, S",Exposing genetic quality: whole-organism performance and life-history trade-offs under genetic and phenotypic stress in the field cricket Teleogryllus commodus,Dr SP Lailvaux,APD
DP0772629,"Hunter, I",An intellectual history of theoretical innovation in the Anglo-American Humanities,Prof IR Hunter,APF
DP0772665,"Evans, J",Vulnerability of the Murray-Darling basin hydrometeorology to human modification,Dr JP Evans,ARF
DP0772679,"Chenoweth, S",The Genetic Basis of Differences Between the Sexes,Dr R Bonduriansky,ARF
DP0772705,"Lieu, S",The impact of cultural contact between China and the Ancient Mediterranean World,Dr J Markley,APD
DP0772706,"Gal, O",The origins of scientific experimental practices: from the anatomical theatre to the conversations of the Royal Society,Mr CT Wolfe,APD
DP0772708,"Rubinstein, J",Statistical Topology and its Application to Deriving New Geometric Invariants,Dr J DeGier,QEII
DP0772763,"Spedding, P",The Dissemination and Control of Clandestine Writing in England 1695--1774,Dr P Spedding,APD
DP0772814,"Fry, B",Evolutionary venomics: Venom system diversification in the animal kingdom ,Dr BG Fry,QEII
DP0772827,"Leslie, D",Spiritual and cross-cultural elements in contemporary Australian art,Dr DM Leslie,APD
DP0772838,"Pandy, M",A Control Systems Approach for Understanding Human Locomotion,Dr JW Fernandez,APD
DP0772880,"Liao, X",Transmission electron microscopy investigation of the deformation mechanisms of nanostructured materials,Dr X Liao,QEII
DP0772881,"Wang, Q",Asymptotic Expansions and Large Deviations in Probability and  Statistics: Theory and Applications,Dr Q Wang,ARF
DP0772887,"McLachlan, G",Multivariate Methods for the Analysis of Microarray Gene-Expression Data with Applications to Cancer Diagnostics,Prof GJ McLachlan,APF
DP0772893,"Harrowell, P",Fluctuation Effects in Non-Crystallising Liquids,Prof CA Angell,APF
DP0772938,"Sijp, W",What controls the shift from a hot house climate to a cold house climate: the Eocene/ Oligocene climate transition and greenhouse warming,Dr WP Sijp,APD
DP0772943,"Prideaux, G",Responses of southern Australian mammal faunas to climate change before and after human arrival,Dr GJ Prideaux,ARF
DP0772946,"Micolich, A",Engineering Ultra-low Disorder Semiconductor Quantum Nanostructures,A/Prof AR Hamilton,APF
DP0772977,"Teesson, M","Fear, sadness and alcohol in adolescence: A test of innovative curriculum models to prevent adverse outcomes.",Ms L Vogl,APD
DP0772999,"Wang, G",First principles for development of novel hybrid electrochemical energy storage and conversion systems,Dr G Wang,QEII
DP0773011,"Sumby, C",Anion Binding and Sensing With Self-Assembled Metallo-Supramolecular Assemblies,Dr CJ Sumby,APD
DP0773029,"Kemp, A",Proterozoic crustal evolution of the Northern Australian Craton revealed from hafnium-oxygen isotope systematics of granite-hosted and detrital zircons,Dr AI Kemp,ARF
DP0773069,"Ostrovskaya, E",Controlled manipulation of matter-waves in atomic waveguiding structures,Dr EA Ostrovskaya,ARF
DP0773081,"Zhao, J","Characterising the tropical ""heat engine"" of global climate: combined coral, stalagmite and tree-ring records from the Indo-Pacific region",Dr K Yu,ARF
DP0773140,"Gell, D",Investigating the molecular function of alpha-Haemoglobin stabilising protein.,Dr DA Gell,ARF
DP0773152,"Eubel, H",Protein Complexes and Supercomplexes of Plant Organelles,Dr H Eubel,APD
DP0773160,"Webley, P",Advanced hierarchical materials for separation applications,Dr X Zhang,ARF
DP0773169,"Schlosshauer, M",Decoherence in quantum computing and quantum electromechanical systems,Dr MA Schlosshauer,APD
DP0773170,"Millie, J","Preaching Islam: politics, performers and publics in Indonesia.",Dr JP Millie,APD
DP0773174,"Dunn, G",The Clash of Sacred and Secular Authority in the Letters of Innocent I,Dr GD Dunn,ARF
DP0773265,"Indyk, I","Australian literary publishing and its economies, 1965-1995",Ms L Poland,APD
DP0773267,"Weller, P",Mapping the policy advisory capacity of the Australian federal government: assessing transformations in the policy advising role of the Australian Public Service,Dr A Tiernan,APD
DP0773307,"Shepherd, C","Sustainable Development, Cultural Diversity, and Global Transformations: An Ethnography of Agricultural and Environmental Practices in East Timor",Dr CJ Shepherd,APD
DP0773324,"McLennan, A",'Fixed points': extending and deepening our understanding of mathematical and computational aspects of game theory,Prof AM McLennan,APF
DP0773408,"Longdell, J",Quantum technologies based on crystalline rare-earth ion doped optical waveguides and resonators,Dr JJ Longdell,APD
DP0773476,"Steinberg, P",Bacterial disease and bleaching of chemically defended marine algae,Dr MW Taylor,APD
DP0773537,"Hoskin, C","Understanding “reinforcement”, an evolutionary process that can lead to the origin of new species and generate species diversity",Mr CJ Hoskin,APD
DP0773544,"Zele, A",Psychophysical Assessment of Receptoral and Post-Receptoral Visual Function,Dr AJ Zele,APD
DP0773579,"Dreher, T",News and Community Conflict: examining the role of journalism in local conflict and conflict resolution,Dr TI Dreher,APD
DP0773589,"Clifford, C",Visual Coding of Motion and Form,A/Prof CW Clifford,ARF
DP0773626,"Dryzek, J",Communication Across Difference in a Democracy: Australian Muslims and the Mainstream,Dr B Kanra,APD
DP0773667,"Schiemer, G",Investigating listening and performance strategies for microtonal composition,Mr WA Burt,APD
DP0773697,"Harrison, R",The colonial souvenir market and Indigenous agency in Oceania,Dr RQ Harrison,APD
DP0773722,"Clements, C",Investigation of the fundamental roles of class Ib MHC (major histocompatibility complex) molecules in immunity,Dr CS Clements,QEII
DP0773741,"Abramson, D",A Unified Grid Programming Methodology for Global e-Science,Prof DA Abramson,APF
DP0773761,"Hartley, R",Computer Vision Optimization Problems Using Machine Learning,Dr L Wang,APD
DP0773794,"Navarro, D",Hierarchical Bayesian Models for Human Conceptual Learning,Dr DJ Navarro,ARF
DP0773830,"Kaas, Q",Theoretical and computational approaches to accurately predict the structures of a unique family of circular and knotted proteins.,Dr Q Kaas,APD
DP0773860,"Ashrafi, A",Pulsed Laser Deposition of Zinc Oxide-based Materials for Optoelectronic Device Applications,Dr AA Ashrafi,APD
DP0773868,"Parr, J",Enhancing long-term soil organic carbon sequestration ,Dr JF Parr,APD
DP0773920,"Fisher, D",Extrinsic threats and biological predisposition in animal extinction and rediscovery,Dr DO Fisher,ARF
DP0773967,"Samarian, A",Dust Physics: a Challenge in International Thermonuclear Experimental Reactor,Dr AA Samarian,QEII
DP0773977,"Liu, Z",Development of Carbon Nanotube Nanothermometers and Their Application for Temperature Measurement in the Catalytic Layers of Fuel Cells,Dr Z Liu,QEII
DP0773984,"Monat, C","Slow light in nonlinear photonic crystals: less haste, more speed",Dr C Monat,APD
DP0774000,"Tinney, C",The Science of Exoplanets - Finding & Understanding our Planetary Neighbours,Dr CG Tinney,APF
DP0774015,"Phillips, M",Uncovering the evolutionary history of Australasian marsupials: combining molecular phylogenetics and ecological inference,Dr MJ Phillips,APD
DP0774063,"Leigh, R",Calcium compartmentation in leaves: testing an integrated model of water and calcium transport with cell specific functional genomics. ,Prof SD Tyerman,APF
DP0774086,"Ninness, B",Advancing System Identification using Modern Optimisation Methods,Dr AG Wills,APD
DP0774113,"Ruitenberg, M",CX3C chemokine signalling in the olfactory epithelium and its role in the self regeneration of the olfactory system,Dr M Ruitenberg,APD
DP0774118,"Robles Kelly, A",Spectral Mutli-camera Tracking,Dr AA Robles Kelly,APD
DP0774121,"Rabeau, J",Diamond based single spin detector,Dr JR Rabeau,APD
DP0774133,"O'Sullivan, P",Categorical splitting theorems in algebraic geometry,Mr PJ O'Sullivan,APD
