Project ID,Project Leader,Project Title,Fellowship recipient,Fellowshiptype
FF0241307,"Dopita, M",The Epoch of Galaxy Formation,Prof MA Dopita,FF
FF0241309,"Otting, G",New Methods for Structural Biology in Solution,Prof G Otting,FF
FF0241328,"Srinivasan, M","Honeybee Vision and navigation, and applications to robotics",Prof M Srinivasan,FF
FF0241369,"Mai, Y",Deformation and Fracture Studies on Polymer Nano-Composites,Prof Y Mai,FF
FF0241380,"Price, H",Closing the Future: New Foundations for the Physics of Possibility,Prof H Price,FF
FF0241382,"Eggleton, B",Engineered optical fibre device structures for next generation telecommunication systems,Dr BJ Eggleton,FF
FF0241390,"Green, M",Silicon Photonics and Third Generation Photovoltaics,Prof MA Green,FF
FF0241391,"Clark, R",Fault-tolerant operation and scale-up of a silicon quantum computer beyond laboratory prototypes,Prof RG Clark,FF
FF0241402,"Coltheart, M","Language, belief formation and visual cognition: cognitive and neuropsychological investigations",Prof M Coltheart,FF
FF0344396,"Durrant-Whyte, H",Information Fusion in Autonomous systems,Prof HF Durrant-Whyte,FF
FF0344414,"Stampfl, C","Application of First-principles Theory in Condensed Matter Physics, Surface Physics, Chemistry, and Engineering:  Coatings, Catalysis, and Devices",Dr CM Stampfl,FF
FF0344672,"Lamb, T",The first stage of vision: transduction and adaptation in retinal photoreceptors,Prof T Lamb,FF
FF0344691,"Kivshar, Y",Nonlinear Photonics and All-Optical Technologies,Prof YS Kivshar,FF
FF0344738,"Hugo, G","The New Paradigm of International Migration to and from Australia: Dimensions, Causes and Implications",Prof GJ Hugo,FF
FF0344917,"Tucker, R",Towards an all-optical Internet,Prof GJ Hugo,FF
FF0344917,"Tucker, R",Towards an all-optical Internet,Prof RS Tucker,FF
FF0345082,"Trimm, D",The conversion of remote location natural gas to fuels and chemicals,Prof DL Trimm,FF
FF0345093,"Turner, S",The time scales of geochemical cycles and earth processes,Dr SP Turner,FF
FF0345330,"Ekers, R",A clearer view of the evolving universe,Dr RD Ekers,FF
FF0345348,"Hughes, T",Science for Sustainable Management of Coral Reef Biodiversity: a multi-disciplinary approach to global-scale processes and patterns,Prof TP Hughes,FF
FF0345363,"Von Itzstein, M",Carbohydrates and Carbohydrate-Recognising Proteins as Drug Discovery Targets,Prof M Von Itzstein,FF
FF0348232,"Quiggin, J","Sustainable reform of the Murray-Darling system: Property rights, uncertainty and institutions",Prof JC Quiggin,FF
FF0348240,"Robinson, P",Physics of Self-Organization: From Space Plasmas to Brain Dynamics,Prof PA Robinson,FF
FF0348299,"Simmons, M",Atomic-scale Devices in Silicon - the Ultimate Limit of Microelectronics,A/Prof MY Simmons,FF
FF0348307,"Johnson, M",Constructing an embryo,Prof MH Johnson,FF
FF0348329,"Luther-Davies, B",Creation of novel photonic and nanostructured materials by ablation of solids with ultra-fast lasers,Prof B Luther-Davies,FF
FF0348346,"Shaw, J",NAVIGABLE CINEMATIC SYSTEMS. The reformulation of cinematic narrative and the development of next generation interactive technology in new media.,Prof J Shaw,FF
FF0348350,"Bachor, H",Quantum and atom optics,Prof HA Bachor,FF
FF0348367,"Tester, M",Salinity tolerance and long-distance transport in cereals,Dr MA Tester,FF
FF0348378,"Lu, G",Molecular Engineered Nanomaterials for Advanced Fuel Cells ,Prof GM Lu,FF
FF0348382,"Maschmeyer, T",From Nanostructured Functional Materials to Sustainable Processes,Prof Dr T Maschmeyer,FF
FF0348393,"Milburn, G",Principles of quantum nanotechnology,Prof GJ Milburn,FF
FF0348465,"Middelberg, A",Engineering Nanostructured Bio-inspired Products,Dr AP Middelberg,FF
FF0348471,"Holmes, A",Probing the Interface Between Polymeric Photonic Materials and Biology,Prof AB Holmes,FF
FF0348478,"Manchester, R",Precision Pulsar Timing and its Applications ,Dr RN Manchester,FF
FF0348522,"Drummond, C","Manipulation of Nano-Scale Assembly, Structure and Interaction: New Drug Delivery Vehicles and Energy Storage Devices for Miniaturised Portable Electronic Products.",Dr CJ Drummond,FF
FF0348537,"Burrage, K",Stochastic Modelling of Genetic Regulatory Networks: Subtitle - Genetic Regulation is a Noisy Business,Prof K Burrage,FF
FF0348540,"Francey, R",New methods assisting the detection and attribution of changes in atmospheric carbon dioxide (CO2) levels,Dr RJ Francey,FF
FF0348550,"Lynch, A",Complexity in climate impact assessment: a methodology to address extremes,Prof AH Lynch,FF
FF0348572,"McCalman, I",Spectacle and Multimedia in Late-Eighteenth-Century Europe: a programme of written and multi-media histories,Prof ID McCalman,FF
FF0348603,"Bartlett, P","Cellular Plasticity in the Brain: discovering molecular mechanisms controlling the production of neurons during brain development, function, ageing and disease.",Prof PF Bartlett,FF
FF0348620,"Ducker, W",Biologically-Inspired Recognition and Processing in Colloidal Systems,A/Prof WA Ducker,FF
FF0348625,"Renfree, M",Genes to phenotype: Exploiting the marsupial model.,Prof MB Renfree,FF
FF0348748,"Kemp, B",How organisms coordinate energy supply and demand,Prof BE Kemp,FF
FF0348750,"Bilek, M",Creation of functional surfaces for biodevices and aerospace applications,Prof MM Bilek,FF
FF0455774,"Brent, R",Exploring the Frontiers of Feasible Computation,Prof RP Brent,FF
FF0455782,"Nielsen, M",Principles of Quantum Information Science,Prof MA Nielsen,FF
FF0455846,"Hodgson, P",Advanced products through multiscale microstructure engineering,Prof PD Hodgson,FF
FF0455859,"Sloan, S",Geostructural stability analysis with adaptive mesh refinement,Prof SW Sloan,FF
FF0455861,"Trau, M",Beyond Microarrays: Nano-Scaled Devices for High Throughput Biomolecular Sensing,Prof M Trau,FF
FF0455865,"Mark, A","Self organization in (bio)molecular systems: Simulating the folding and aggregation of peptides, proteins and lipids.",Prof AE Mark,FF
FF0455875,"Hill, D","COMPLEX NETWORKS: DYNAMICS, OPTIMIZATION AND CONTROL",Prof DJ Hill,FF
FF0456002,"Bradford, M","Advanced analysis, behaviour and design of steel and steel-concrete composite engineering structures subjected to elevated temperatures",Prof MA Bradford,FF
FF0456020,"Hoffmann, A",Evaluating the adaptive potential of organisms to respond to environmental change,Prof AA Hoffmann,FF
FF0456170,"Simpson, S",Integrative behaviour: a new synthesis,Prof SJ Simpson,FF
FF0456284,"Simmons, L",The evolution of female mating frequency and its consequences,Prof LW Simmons,FF
FF0456432,"Crain, S",Logic and language: Foundations of cognitive growth,Prof S Crain,FF
FF0456591,"Pettit, P","The Foundation, Role, and Design of Democracy",Prof PN Pettit,FF
FF0456723,"Grant, S","Optimism, Pessimism and Confidence - Their economic impacts",Prof SH Grant,FF
FF0456798,"Wong, R",Assembly of neural circuits during development,A/Prof RO Wong,FF
FF0456888,"Hyde, S",Self-assembly and complexity: networks and patterns from materials to markets,Prof ST Hyde,FF
FF0456931,"Chalmers, D",The Contents of Consciousness,Prof DJ Chalmers,FF
FF0456999,"Wood, B",Origin and Evolution of the Earth's Chemical Reservoirs,Prof B Wood,FF
FF0457012,"Jagadish, C",Ordered Semiconductor Nanostructures for Electronics and Photonics Applications,Prof C Jagadish,FF
FF0457313,"Cooper, A",Using ancient DNA to understand Australia's past and manage its future,Prof A Cooper,FF
FF0457488,"Trewhella, J",Molecular Mechanisms of Biochemical Regulation: Neutron and X-ray Scattering Studies,Dr J Trewhella,FF
FF0457721,"Smith, S",Metabolomic and genetic approaches to the discovery of genes that direct carbon partitioning in plants,Dr S Smith,FF
FF0457917,"Griffiths, P","Biohumanities: Philosophical, Historical, and Socio-Cultural Studies of Contemporary Bioscience",Dr PE Griffiths,FF
FF0458313,"Wiseman, H","Quantum Measurement, Control and Information: Forging Links to Underpin Quantum Technology",A/Prof HM Wiseman,FF
FF0458331,"Bush, A",The Role of Metals in the Biology of the Ageing Brain,A/Prof AI Bush,FF
FF0561298,"Gaensler, B",The Origin and Evolution of Cosmic Magnetism,Asst Prof BM Gaensler,FF
FF0561326,"Bowman, J",Role of an ancient genetic program in the elaboration of plant architecture,Dr JL Bowman,FF
FF0561357,"Bond, A",Integration of Electrochemistry and Green Chemistry: A Roadmap for Scientific Innovation,Prof AM Bond,FF
FF0561365,"Shine, R",Ecology and evolution in dynamic systems: a new approach to conserving Australian biodiversity,Prof R Shine,FF
FF0561370,"Barme, G",Beijing: China's Heritage and the City as Spectacle,Prof GR Barme,FF
FF0561371,"Kobe, B",New approaches to functional and structural genomics,A/Prof B Kobe,FF
FF0561426,"Marshall, L","Optical Semiconductors for next-generation lasers, optical processors, and integrated optical chips",Dr LR Marshall,FF
FF0561429,"Muddle, B",Design in Nanostructured Materials - Formation and Stability of Nanostructure in Light Alloys and Light Metal Hybrids,Prof BC Muddle,FF
FF0561455,"Fitzpatrick, S",RUSSIA (THE SOVIET UNION) AND AUSTRALIA IN THE 20TH AND 21ST CENTURIES,Dr SM Fitzpatrick,FF
FF0561456,"Kepert, C",Advanced Molecular Nanomaterials,Dr CJ Kepert,FF
FF0561473,"Randolph, M",Geotechnical engineering solutions for deep-water oil and gas developments,Prof MF Randolph,FF
FF0561486,"Mulvaney, P",Energy Conversion and Signal Transduction in Nanomechanical Systems,A/Prof PC Mulvaney,FF
FF0561487,"Schmidt, B",Understanding the Evolution of the Universe,Prof BP Schmidt,FF
FF0561681,"Charlesworth, H",Building Democracy and Justice after Conflict,Prof HC Charlesworth,FF
FF0561698,"Davis, T",Constructing The Building Blocks For Future Nanomaterial Design: Self-assembly and Information Storage in Synthetic Macromolecules,Prof TP Davis,FF
FF0561734,"England, M",Genesis of Australian Climate Extremes in the Southern Hemisphere Extratropical Ocean-Atmosphere,A/Prof MH England,FF
FF0561735,"Maini, P",Multiscale modelling: Applications to the Biomedical Sciences,Prof PK Maini,FF
FF0561746,"Vaux, D",Molecular control of apoptosis and protein homeostasis,Prof DL Vaux,FF
FF0561762,"Parker, A",The diversity and assembly of optics in nature,Dr AR Parker,FF
FF0561843,"Keane, M",Understanding and Modeling Individual Choices in Applied Economics,Prof MP Keane,FF
FF0561883,"Smith, J",Neutron Scattering in Biology,Prof JC Smith,FF
FF0561901,"Hodges, J",Human long-term memory and social cognition: an integrated cognitive neuroscience approach,Prof JR Hodges,FF
FF0561981,"Hartley, J","The Uses of Multimedia: Citizen Consumers, Creative Participation and Innovation in Australian Digital Content",Prof J Hartley,FF
FF0561986,"Mattick, J",The genomic programming of complex organisms,Prof JS Mattick,FF
FF0668632,"Studdert, D",Using Law To Improve Population Health and the Quality of Health Care Services,A/Prof DM Studdert,FF
FF0668673,"Haddad, P",Separation science based on nanoparticle-coated monolithic scaffold stationary phases,Prof PR Haddad,FF
FF0668679,"Karoly, D",Improving understanding of climate change and its impacts in Australia through detection and attribution of climate change,Prof DJ Karoly,FF
FF0668690,"Nugent, K",Coherent X-ray Science and Biophysics,Prof KA Nugent,FF
FF0668703,"Marusic, I",Wall Turbulence Drag: Physical Mechanisms and Practicable Control Strategies,Prof I Marusic,FF
FF0668705,"McFadden, G",Drug targets in malaria parasites,Prof GI McFadden,FF
FF0668706,"Hughes, T",Science for resilience of coral reef systems,Prof TP Hughes,FF
FF0668718,"Van Hentenryck, P",Adaptive and Integrated Resource Allocation,Prof PR Van Hentenryck,FF
FF0668728,"Burn, P",Dendritic Organic Semiconductors,Dr P Burn,FF
FF0668730,"Lindsey, T","Islam and Modernity: Syari'ah, Terrorism and Governance in South-East Asia",Prof TC Lindsey,FF
FF0668731,"Vidal, G",Quantum Information and Entanglement: a new framework for Science and Technology with quantum many-body systems,Prof G Vidal,FF
FF0668733,"Fairlie, D",Chemical Mimics Of Bioactive Protein Surfaces,Prof DP Fairlie,FF
FF0668747,"Hall, P","Nonparametric Statistical Methods -- New Directions, Theory and Applications",Prof PG Hall,FF
FF0668775,"Turner, G",Television in the post-broadcast era: the role of old and new media in the formation of national communities,Prof G Turner,FF
FF0668778,"Possingham, H",Theory for global biodiversity conservation,Prof HP Possingham,FF
FF0668784,"Braithwaite, J","Restorative Justice and Responsive Governance:  Fresh Challenges, New Theory, Global Networks",Prof J Braithwaite,FF
FF0668802,"Rossjohn, J","An investigation into Infection, Immunity & Rational Drug Design",Dr J Rossjohn,FF
FF0668810,"White, A",Integrated quantum photonics,Prof AG White,FF
FF0668962,"Green, M",Nanostructured Silicon-Based Tandem Solar Cells,Prof MA Green,FF
FF0669018,"Parker, M",Structural neurobiology - developing a new capability in Australia to treat mental illness,Prof MW Parker,FF
FF0669110,"Wallace, G",Nanobionics,Prof GG Wallace,FF
FF0669133,"Burry, M",Complex Architecture and Convergent Design,Prof MC Burry,FF
FF0669149,"Goodnow, C",Discovering genes and mechanisms regulating immune responses,Prof CC Goodnow,FF
FF0669159,"Kiernan, B","Cambodia: Place, People and Politics; Environmental, Economic, Cultural, Political, and Regional History since Earliest Times",Prof BF Kiernan,FF
FF0669224,"Shippenberg, T",Cellular and Neurochemical Basis of Drug Addiction,Dr TS Shippenberg,FF
FF0776050,"MacFarlane, DR",Biocompatible Ionic Liquids - Preserving Bioactive Structure and Function,Prof DR MacFarlane,FF
FF0776056,"Eggleton, BJ",Ultrafast photonic integrated circuits: Unlocking the bandwidth,Prof BJ Eggleton,FF
FF0776072,"McSherry, BM",Rethinking Mental Health Laws: An Integrated Approach,Prof BM McSherry,FF
FF0776078,"Caruso, F",Building Molecularly Engineered Polymer Nanomaterials,Prof F Caruso,FF
FF0776096,"Koopman, PA",Deciphering genome function in animal development,Prof PA Koopman,FF
FF0776122,"Pannell, DJ","Integrating economics and science for land, water and biodiversity policy",Prof DJ Pannell,FF
FF0776124,"Kivshar, YS","All-optical technologies, nanophotonics, and metamaterials",Prof YS Kivshar,FF
FF0776147,"Heath, WR",In vivo imaging of the immune system in self tolerance and infectious disease.,Dr WR Heath,FF
FF0776153,"Gherghetta, T",The New Dimensions of the Quantum Universe,A/Prof T Gherghetta,FF
FF0776177,"Quiggin, JC",Climate change: adaptation and resilience in the face of uncertainty,Prof JC Quiggin,FF
FF0776180,"Niemann, H",Embryo genomics for engineering change,Prof Dr H Niemann,FF
FF0776186,"Praeger, CE","Group actions: combinatorics, geometry and computation",Prof CE Praeger,FF
FF0776190,"Durrant-Whyte, HF",Data Fusion and Perception in Autonomous Networks,Prof HF Durrant-Whyte,FF
FF0776191,"Milburn, GJ",Quantum Nanoscience.,Prof GJ Milburn,FF
FF0776220,"Petersen, IR",Robust and Distributed Control of Quantum Systems,Prof IR Petersen,FF
FF0776223,"Price, H",A Practical Theory of Factual Information: Fundamentals and Applications in Philosophy and Physics,Prof H Price,FF
FF0776229,"Hodges, JR",Long-term memory systems and the human brain,Prof JR Hodges,FF
FF0776384,"Bland-Hawthorn, J",Astrophotonics: exploiting a new technological frontier to probe back to the Dark Ages,Dr J Bland-Hawthorn,FF
FF0776465,"Clark, RG",Coherent Transport of Spin Qubits in an Engineered-Atom Silicon Quantum Computer: Demonstrating the Critical Spintronics,Prof RG Clark,FF
FF0776510,"Waterhouse, PM","Small RNAs: what makes a plant, a plant",Dr PM Waterhouse,FF
LC0348248,"Forbes, D",The Evolution of Gas in Galaxy Groups,Dr VA Kilborn,APDC
LC0348317,"Davidson, M",DROP DEFORMATION IN CONFINED MICROFLUIDIC GEOMETRIES,Dr DJ Harvie,APDC
LC0348353,"Burton, M",Star Formation at Millimetre Wavelengths with the CSIRO Australia Telescope,Dr TH Wong,APDC
LC0348504,"England, M",Quantifying the role of the Southern Ocean for anthropogenic CO2 uptake,Dr BI McNeil,APDC
LC0348524,"Batterham, P",The Cytochrome P450 Gene Super-family in Drosophila melanogaster; Gene Function and Insecticide Resistance,Dr PJ Daborn,APDC
LC0348576,"Dixon, N",Subunit Contacts in a Replicative DNA Polymerase: A New Paradigm for Protein-Protein Interactions?,Dr K Ozawa,APDC
LC0348594,"Craik, D",Development of Novel Pesticidal Agents,Dr ML Colgrave,APDC
LC0348615,"Esselle, K",Photonic Crystal Signal Processing and Antenna Technologies,Dr AR Weily,APDC
LC0348657,"Yu, A",Fundamental studies of the packing and compaction of fine particles,Dr R Yang,APDC
LC0348689,"Soria, J",Atomisation and Combustion Physics of Australian Bio-oils,Dr V Stamatov,APDC
LP0209078,"Kepert, C",Porous Mineral Formulations for Controlled-Release Applications,Dr SJ Thomson,APDI
LP0209231,"Blows, J",Optical parametric amplifiers with exceptional qualities using highly nonlinear optical fibre,Dr JL Blows,APDI
LP0209231,"Blows, J",Optical parametric amplifiers with exceptional qualities using highly nonlinear optical fibre,Mr P Blazkiewicz,APDI
LP0209614,"Neal, A","An evaluation of the effects of individual and environmental factors on participation in training, and the quality of training outcomes",Miss CC Boag,APDI
LP0210571,"Cowling, W",Exploiting the Arabidopsis genome sequence as a molecular 'toolbox' for Brassica improvement,Dr K Bayliss,APDI
LP0210658,"Nielsen, L",Metabolic engineering of sugarcane: production of a biodegradable bioplastic as a test-case,Mr M Purnell,APDI
LP0210907,"Watts, M",The cellular basis of temperature impairment of reproductive function in Atlantic salmon ,Dr M Watts,APDI
LP0211065,"Pethybridge, S",Epidemiology of Phoma spp. complex and other foliar pathogens affecting pyrethrum,Dr SJ Pethybridge,APDI
LP0211206,"Kuczera, G",Optimal Source Control in Urban Water Cycle Management,Mr P Coombes,APDI
LP0211375,"Whittington, I",Integrated management of pathogenic monogenean (flatworm) parasite infections in warm water finfish aquaculture,Dr I Ernst,APDI
LP0211420,"Vanclay, F",Activating and maintaining community participation in natural and cultural resources initiatives in the Murray-Darling Basin,Dr P Sinclair,APDI
LP0211472,"Langton, M","Agreements, Treaties and Negotiated Settlements with Indigenous Peoples in Settler States: their role and relevance for Indigenous and other Australians",Ms L Palmer,APDI
LP0211499,"King, D","Natural Hazard Vulnerability: A study of risk, vulnerability, behaviour, attitudes and perceptions of warnings",Ms L Anderson-Berry,APDI
LP0211545,"Parry, L","Relaxin action in the heart, kidney, lung and uterus: understanding fibrosis",Dr CS Samuel,APDI
LP0211607,"Walkden-Brown, S",Molecular approaches to solving current and emerging problems in the epidemiology and diagnosis of Marek's disease in Australia,Mr AF Islam,APDI
LP0211846,"Mills, D",Multi Tower Solar Array (MTSA) for combined heat and power applications in urban areas,Dr CJ Dey,APDI
LP0211940,"Evans, G",In vitro prediction tests of fertility of frozen semen of sheep and cattle,Dr L Gillan,APDI
LP0211975,"Malherbe, M",Reforming of Liquid Hydrocarbon Fuels for Application in Solid Oxide Fuel Cells Technology,Dr PC Andy,APDI
LP0212042,"McArthur, C",Understanding and manipulating stress physiology of eucalypt seedlings to improve survival and growth,Mr DC Close,APDI
LP0212075,"Eyre, B",The Impact of Trawling on Nitrogen Removal through Sediment Denitrification in Western Moreton Bay,Mr A Ferguson,APDI
LP0212117,"Possingham, H",Predicting metapopulation dynamics with multiple patch states,Dr RA Tyre,APDI
LP0214128,"Dawson, W",How tired is too tired? Determining the effects of fatigue on pilots' performance in a simulated flight environment,Mr G Roach,APDI
LP0214139,"Warr, G",Improving explosive emulsions by understanding surfactant interactions,Dr TW Davey,APDI
LP0218847,"Strugnell, R","The molecular pathogenesis of Equine rhinitis A virus, a major respiratory pathogen of horses",Ms T Hinton,APDI
LP0218848,"Kennedy, I",POLYMER-BASED COATINGS TO INCREASE THE SURVIVAL OF MICROBIAL INOCULANTS APPLIED TO AGRICULTURAL SEEDS,Ms R Deaker,APDI
LP0218877,"Stokoe, R",Potential of Corymbia torelliana hybrids for hardwood forestry and investigation of their seed dispersal by Trigona bees,Ms R Stokoe,APDI
LP0219352,"O'Neil, J",Prediction and Management Strategies for Blooms of the Toxic Cyanobacterium Lyngbya majuscula in Coastal Australian Waters,Dr T Lukondeh,APDI
LP0219387,"Pate, D",The Adelaide Hills Face Zone: Reconstructing the cultural landscape and the identification of sites of cultural significance.,Dr PA Smith,APDI
LP0219471,"Sullivan, L","Wetland regeneration for effluent reuse, acid sulfate soil management and carbon credits.",Dr K Bolton,APDI
LP0219720,"Witcomb, A","Place, taste and tradition: A history of ideas about heritage in Western Australia as a foundation for change.",Ms J Sassoon,APDI
LP0219724,"Sullivan, L",Drains in acid sulfate soils: behaviour and management for optimal water quality,Mr RT Bush,APDI
LP0219784,"Leaney, J",Architecture-based Open Network Management Systems for Next Generation Telecommunications,Dr T O'Neill,APDI
LP0346925,"Croft, D",Saving Wildlife: Saving People On Our Roads,Dr D Ramp,APDI
LP0346973,"Schembri, A",Sociolinguistic variation in Australian Sign Language (Auslan): Theoretical and applied dimensions,Dr A Schembri,APDI
LP0347021,"Kalyanasundaram, S",Stamp forming of lightweight fibre-metal laminate systems,Dr P Compston,APDI
LP0347084,"Bilek, M",The Surface Science of Vacuum Glazing,Dr N Ng,APDI
LP0347126,"Thompson, R",Optimisation of cell culture and molecular typing for the characterisation of  Cryptosporidium in water.,Ms N Hijjawi,APDI
LP0347167,"Sargison, J",Improvement of water conveying efficiency in hydroelectric power generation systems by optimising pipe friction losses,Dr JE Sargison,APDI
LP0347221,"Peterson, N","Anthropological and Aboriginal perspectives on the Donald Thomson Collection: material culture, collecting and identity",Dr ML Hamby,APDI
LP0347332,"Salisbury, S","Life and environments of the Lower Cretaceous Winton Formation, western Queensland: The Winton Dinosaur Project",Dr SW Salisbury,APDI
LP0347389,"Barber, J",Disruptive children in alternative care: new approaches to the prevention of placement breakdown. ,Ms R Gilbertson,APDI
LP0347556,"Pecl, G",Tracking squids from embryos to adults - novel approaches and new directions,Dr GT Pecl,APDI
LP0347616,"Giles, D",Evolution of the Proterozoic lithosphere and its bearing of sediment hosted base metal mineralisation,Dr D Giles,APDI
LP0347709,"Sofoulis, Z","Transforming Drivers:  Driving as Social, Cultural and Gendered Practice",Ms S Redshaw,APDI
LP0347711,"Beardall, J",Taxonomic discrimination and compositional analysis of microalgae using Fourier-transform infrared (FT-IR) spectroscopy,Dr P Heraud,APDI
LP0347734,"Menzies, N",Conservation tillage and its potential to affect catchment salt and water balances,Ms K Page,APDI
LP0347788,"Griffin, M","Unravelling Leadership Development: Evaluating outcomes, contrasting interventions, and exploring processes",Dr CM Mason,APDI
LP0348863,"Masselos, J",Couples: depictions of sexuality in South and Southeast Asian art,Mr AO Carton,APDI
LP0348864,"Williams, M",Responding to the threat of climate change: identifying effective strategies for the wheat industry of  south-east Australia ,Ms Q Luo,APDI
LP0348909,"Hay, P",Environmental Education and Marine Ecosystem Degradation: The Role of Site-specific Art as Communicative Strategy within Community Awareness-raising Programs,Ms JW Quon,APDI
LP0348930,"Anderson, V",Cerebral plasticity or early vulnerability?  Identifying critical periods for childhood development and recovery.,Ms R Jacobs,APDI
LP0348945,"Zhang, D",Mechanisms of Ammonium Nitrate Decomposition and Stability of Industrial Explosives in Reactive Mining Grounds,Mr B Feng,APDI
LP0348958,"Hobbs, R",Rapid genetic delineation of local provenance for effective restoration of urban bushland remnants,Dr JD Bussell,APDI
LP0348994,"Nayar, C",CONTROL AND INTERFACING OF GRID-CONNECTED IGBT INVERTERS FOR SMALL-SCALE WIND GENERATORS ,Mr H Dehbonei,APDI
LP0349004,"Bond, A",Fabrication and Application of Ion-Sensors Based on the Voltammetry of Nanocrystals Adhered to Electrode Surfaces,Dr J Zhang,APDI
LP0349048,"Wu, Y",Development of sophisticated structural design guidelines for the new building product known as Rapidwall,Dr Y Wu,APDI
LP0349069,"Velonaki, M",Fish-Bird: Autonomous Interactions in a Contemporary Arts Setting,Ms M Velonaki,APDI
LP0349104,"Batty, A",Biology and Integrated conservation of temperate Australian orchids,Dr AL Batty,APDI
LP0349118,"Harry, E",Bacterial Proteomics: From Cell Division to Novel Antibiotic Targets,Dr S Srinivasan,APDI
LP0349175,"Miller, P",Estimation of School Cost Functions ,Ms M Giles,APDI
LP0349199,"Finston, T","Genetic evaluation of the diversity of the stygobitic fauna of the Pilbara, Western Australia",Dr TL Finston,APDI
LP0349203,"Van Berkel, R",Enhancing regional resource synergies through the application of industrial ecology strategies for sustainable development in the Kwinana Industrial Area ,Mr W Altham,APDI
LP0349211,"Marks, J","Acceptability of reclaimed water use in urban Australia: Establishing a baseline and variations based on experience, consultation and trust.",Ms J Marks,APDI
LP0349255,"Ryan, U",Validating protozoa-specific drug targets using peptides from biodiverse gene fragment libraries,Ms L MacDonald,APDI
LP0453538,"Ringer, S",Quantitative Atom Probe Tomography for Nanostructural Analysis of Materials,A/Prof SP Ringer,LIF
LP0453550,"Kear, B",Australian fossil marine reptiles: a research and regional museum program,Mr BP Kear,APDI
LP0453591,"Barry, K",Determining generic indicators of stress in eucalypt leaves for application to the remote sensing of canopy condition and productivity modelling,Dr KM Barry,APDI
LP0453612,"Bellwood, D",Environmental management of coral reef resilience,Dr MS Pratchett,APDI
